ORIGIN	OTS	INALI	OTQ
"N'a nt'udi di ge'a nuya nthoki bri t'o̱t'e ha ya hñä ya ndeznä ra ngätsi ra nthebe nje̱ya ra r'e̱t'a ma gu̱to (S. XIX), r'a ya hnini ngu ra Xicontepec (Villa Juárez) nuna hyodi kohi nuni Puebla."	"n'a nt'udi di ge'a nuya ntjoki bri t'o̱t'e ja ya jñä ya ndeznä ra ngätsi ra ntjebe nje̱ya ra r'e̱t'a ma gu̱to (s. xix), r'a ya jnini ngu ra xicontepec (villa juárez) nuna jyodi koji nuni puebla."	"n'a nt'udi di ge'a nuya nthoki bri t'o̱t'e ha ya hñä ya ndeznä ra ngätsi ra nthebe nje̱ya ra r'e̱t'a ma gu̱to (s. xix), r'a ya hnini ngu ra xicontepec (villa juárez) nuna hyodi kohi nuni puebla."	"n'a nt'udi di ge'a nuya nthoki bri t'o̱t'e ha ya hñä ya ndeznä ra ngätsi ra nthebe nje̱ya ra r'e̱t'a ma gu̱to (s. xix), r'a ya hnini ngu ra xicontepec (villa juárez) nuna hyodi kohi nuni puebla."
gopareháhé primero 'á k'a ra parte ánk'ú dínant'í	goparejájé primero 'á k'a ra parte ánk'ú dínant'í	gopareháhé primero 'á k'a ra parte ánk'ú dínant'í	gopareháhé primero 'á k'a ra parte ánk'ú dínant'í
"Xkri tso̱ngä Ngosthi, ja hehni ya 'ñu; nä'ä rí ma Nxamädo, ha nä'ä rí ma Mäbo̱za. Antes de"	"xkri tso̱ngä ngostji, ja jejni ya 'ñu; nä'ä rí ma nxamädo, ja nä'ä rí ma mäbo̱za. antes de"	"xkri tso̱ngä ngosthi, ja hehni ya 'ñu; nä'ä rí ma nxamädo, ha nä'ä rí ma mäbo̱za. antes de"	"xkri tso̱ngä ngosthi, ja hehni ya 'ñu; nä'ä rí ma nxamädo, ha nä'ä rí ma mäbo̱za. antes de"
"Pa da t'unga mfädi gatho nu'u̱ bi nja, n'a di ge'u̱ ko ngu fe̱ti nu'a majuäni mi hoki mi thutsuabi ya hnei ne ya b'ida. B'u̱i man'a ra mfädi da t'o̱t'a ra nt'udi, nu'a ra thuhu ""fe̱ta nu'a majuäni bi nja nub'u̱ ra tsokat'o̱tamfeni (teatro de la conquista)""."	"pa da t'unga mfädi gatjo nu'u̱ bi nja, n'a di ge'u̱ ko ngu fe̱ti nu'a majuäni mi joki mi tjutsuabi ya jnei ne ya b'ida. b'u̱i man'a ra mfädi da t'o̱t'a ra nt'udi, nu'a ra tjuju ""fe̱ta nu'a majuäni bi nja nub'u̱ ra tsokat'o̱tamfeni (teatro de la conquista)""."	"pa da t'unga mfädi gatho nu'u̱ bi nja, n'a di ge'u̱ ko ngu fe̱ti nu'a majuäni mi hoki mi thutsuabi ya hnei ne ya b'ida. b'u̱i man'a ra mfädi da t'o̱t'a ra nt'udi, nu'a ra thuhu ""fe̱ta nu'a majuäni bi nja nub'u̱ ra tsokat'o̱tamfeni (teatro de la conquista)""."	"pa da t'unga mfädi gatho nu'u̱ bi nja, n'a di ge'u̱ ko ngu fe̱ti nu'a majuäni mi hoki mi thutsuabi ya hnei ne ya b'ida. b'u̱i man'a ra mfädi da t'o̱t'a ra nt'udi, nu'a ra thuhu ""fe̱ta nu'a majuäni bi nja nub'u̱ ra tsokat'o̱tamfeni (teatro de la conquista)""."
po nuya ja'i to'o mi pede ge fädi ko ra thuhu ya “cronistas de las Indias”	"po nuya ja'i to'o mi pede ge fädi ko ra tjuju ya ""cronistas de las indias”"	"po nuya ja'i to'o mi pede ge fädi ko ra thuhu ya ""cronistas de las indias"""	"po nuya ja'i to'o mi pede ge fädi ko ra thuhu ya ""cronistas de las indias"""
"Bi yu̠t'a M'onda ko ngatho ya munts'a ndaro dega ñämfo̠ ya ñ'oui ya me̠tlaxcala ne mar'a, ra pa mi feni ra ngo ra San Juan Bautista, into bi daki."	"bi yu̱t'a m'onda ko ngatjo ya munts'a ndaro dega ñämfo̱ ya ñ'oui ya me̱tlaxtsala ne mar'a, ra pa mi feni ra ngo ra san juan bautista, into bi daki."	"bi yu̱t'a m'onda ko ngatho ya munts'a ndaro dega ñämfo̱ ya ñ'oui ya me̱tlaxtsala ne mar'a, ra pa mi feni ra ngo ra san juan bautista, into bi daki."	"bi yu̱t'a m'onda ko ngatho ya munts'a ndaro dega ñämfo̱ ya ñ'oui ya me̱tlaxtsala ne mar'a, ra pa mi feni ra ngo ra san juan bautista, into bi daki."
Mi fo̱tuabi ya ts'u̠tnibo̠ja mi thutuabi ya hñämfo̠ ra pasadores nehe ya bo̠zna ko ya nzafi.	mi fo̱tuabi ya ts'u̱tnibo̱ja mi tjutuabi ya jñämfo̱ ra pasadores neje ya bo̱zna ko ya nzafi.	mi fo̱tuabi ya ts'u̱tnibo̱ja mi thutuabi ya hñämfo̱ ra pasadores nehe ya bo̱zna ko ya nzafi.	mi fo̱tuabi ya ts'u̱tnibo̱ja mi thutuabi ya hñämfo̱ ra pasadores nehe ya bo̱zna ko ya nzafi.
"Ne ri mpe̱fi ha ra dängan gu nt'udi ra thuhu ra Facultad de Estudios Superiores, Acatlán, UNAM,"	"ne ri mpe̱fi ja ra dängan gu nt'udi ra tjuju ra facultad de estudios superiores, acatlán, unam,"	"ne ri mpe̱fi ha ra dängan gu nt'udi ra thuhu ra facultad de estudios superiores, acatlán, unam,"	"ne ri mpe̱fi ha ra dängan gu nt'udi ra thuhu ra facultad de estudios superiores, acatlán, unam,"
"Tlauhquechol: ra ts'ints'u̱ xa ntheni pode ge'a ra flamenco o ra guacamaya, pode ge gatho ra the̱nga ts'ints'u̱ ne dänga."	"tlauhquechol: ra ts'ints'u̱ xa ntjeni pode ge'a ra flamenco o ra guacamaya, pode ge gatjo ra tje̱nga ts'ints'u̱ ne dänga."	"tlauhquechol: ra ts'ints'u̱ xa ntheni pode ge'a ra flamenco o ra guacamaya, pode ge gatho ra the̱nga ts'ints'u̱ ne dänga."	"tlauhquechol: ra ts'ints'u̱ xa ntheni pode ge'a ra flamenco o ra guacamaya, pode ge gatho ra the̱nga ts'ints'u̱ ne dänga."
"Nu'a ma r'a ya jä'i mi pädi nuña b'e̱fi bri b'e̱pabi xa hyoki yoho ya mpe̱fi mi fädi ko ra thuhu ra amosqueador ko ya xi ya ts'ints'u̱ xi sta hotho, gi hutsuabi made dige'a n'a ra zänä dega k'astaboja"	"nu'a ma r'a ya jä'i mi pädi nuña b'e̱fi bri b'e̱pabi xa jyoki yojo ya mpe̱fi mi fädi ko ra tjuju ra amosqueador ko ya xi ya ts'ints'u̱ xi sta jotjo, gi jutsuabi made dige'a n'a ra zänä dega k'astaboja"	"nu'a ma r'a ya jä'i mi pädi nuña b'e̱fi bri b'e̱pabi xa hyoki yoho ya mpe̱fi mi fädi ko ra thuhu ra amosqueador ko ya xi ya ts'ints'u̱ xi sta hotho, gi hutsuabi made dige'a n'a ra zänä dega k'astaboja"	"nu'a ma r'a ya jä'i mi pädi nuña b'e̱fi bri b'e̱pabi xa hyoki yoho ya mpe̱fi mi fädi ko ra thuhu ra amosqueador ko ya xi ya ts'ints'u̱ xi sta hotho, gi hutsuabi made dige'a n'a ra zänä dega k'astaboja"
"ne bi unbabi ndunthi ya baba, bi enbabi ge mi ne da ñäui ra Ndä (emperador) mi b'u̱i nuni manhyati, ne da häni ra dänga ts'ofo ra evangelio,"	"ne bi unbabi nduntji ya baba, bi enbabi ge mi ne da ñäui ra ndä (emperador) mi b'u̱i nuni manjyati, ne da jäni ra dänga ts'ofo ra evangelio,"	"ne bi unbabi ndunthi ya baba, bi enbabi ge mi ne da ñäui ra ndä (emperador) mi b'u̱i nuni manhyati, ne da häni ra dänga ts'ofo ra evangelio,"	"ne bi unbabi ndunthi ya baba, bi enbabi ge mi ne da ñäui ra ndä (emperador) mi b'u̱i nuni manhyati, ne da häni ra dänga ts'ofo ra evangelio,"
"inga se̱he̱ ra nnthandi ra manhyati ne ra portuguesa nehe ra francesa, inglesa, alemana e italiana,"	"inga se̱je̱ ra nntjandi ra manjyati ne ra portuguesa neje ra francesa, inglesa, alemana e italiana,"	"inga se̱he̱ ra nnthandi ra manhyati ne ra portuguesa nehe ra francesa, inglesa, alemana e italiana,"	"inga se̱he̱ ra nnthandi ra manhyati ne ra portuguesa nehe ra francesa, inglesa, alemana e italiana,"
"Ya r'atsanoya ra Sahagán, Ndoxjua k'oi Florentino, lib. XII, caps. XXIX-XLI (versión de Ángel Ma. Garibay K.)."	"ya r'atsanoya ra sahagán, ndoxjua k'oi florentino, lib. xii, caps. xxix-xli (versión de ángel ma. garibay k.)."	"ya r'atsanoya ra sahagán, ndoxjua k'oi florentino, lib. xii, caps. xxix-xli (versión de ángel ma. garibay k.)."	"ya r'atsanoya ra sahagán, ndoxjua k'oi florentino, lib. xii, caps. xxix-xli (versión de ángel ma. garibay k.)."
"Ma dada'ihe gra ts'u̱tui, di ne gi pädi ge ma me̱t'o instä thogihe nuna thogi gatho ya mapa xki r'ani, bi juat'i ko ngeke nu̱'u ri b'e̱go, ri me̱fi ya ñämfo̱, ra nge'a majuäni ra Hernando Cortés ra ndä gabida,"	"ma dada'ije gra ts'u̱tui, di ne gi pädi ge ma me̱t'o instä tjogije nuna tjogi gatjo ya mapa xki r'ani, bi juat'i ko ngeke nu̱'u ri b'e̱go, ri me̱fi ya ñämfo̱, ra nge'a majuäni ra hernando cortés ra ndä gabida,"	"ma dada'ihe gra ts'u̱tui, di ne gi pädi ge ma me̱t'o instä thogihe nuna thogi gatho ya mapa xki r'ani, bi juat'i ko ngeke nu̱'u ri b'e̱go, ri me̱fi ya ñämfo̱, ra nge'a majuäni ra hernando cortés ra ndä gabida,"	"ma dada'ihe gra ts'u̱tui, di ne gi pädi ge ma me̱t'o instä thogihe nuna thogi gatho ya mapa xki r'ani, bi juat'i ko ngeke nu̱'u ri b'e̱go, ri me̱fi ya ñämfo̱, ra nge'a majuäni ra hernando cortés ra ndä gabida,"
"Ra Fernando Ramírez mä ge nuna hyodi ri nge̠pu̱ habu̱ ja n'a ra nija ra San Fernando ne ra Ermita dige'a ya Mártires dige'a San Hipólito,"	"ra fernando ramírez mä ge nuna jyodi ri nge̱pu̱ jabu̱ ja n'a ra nija ra san fernando ne ra ermita dige'a ya mártires dige'a san hipólito,"	"ra fernando ramírez mä ge nuna hyodi ri nge̱pu̱ habu̱ ja n'a ra nija ra san fernando ne ra ermita dige'a ya mártires dige'a san hipólito,"	"ra fernando ramírez mä ge nuna hyodi ri nge̱pu̱ habu̱ ja n'a ra nija ra san fernando ne ra ermita dige'a ya mártires dige'a san hipólito,"
"—nu'u̱ dige'u̱ b'u̱i nuni Maxey (Tolimán ne Amealco), dige'u̱ Temoaya nuni ra ra hyodi estado de México ne mar'a ya hyodi nuni Puebla ne Veracruz"	"-nu'u̱ dige'u̱ b'u̱i nuni maxey (tolimán ne amealco), dige'u̱ temoaya nuni ra ra jyodi estado de méxico ne mar'a ya jyodi nuni puebla ne veracruz"	"-nu'u̱ dige'u̱ b'u̱i nuni maxey (tolimán ne amealco), dige'u̱ temoaya nuni ra ra hyodi estado de méxico ne mar'a ya hyodi nuni puebla ne veracruz"	"-nu'u̱ dige'u̱ b'u̱i nuni maxey (tolimán ne amealco), dige'u̱ temoaya nuni ra ra hyodi estado de méxico ne mar'a ya hyodi nuni puebla ne veracruz"
"Ebu̱ bi bo̱ni, bi meui nuni Nonohualco, ha ra Ngu ra B'ongui habu̱ ra gabida ne ra Malintzin ne ""ra hyadi"" (Alvarado) ne ra Sandoval."	"ebu̱ bi bo̱ni, bi meui nuni nonohualco, ja ra ngu ra b'ongui jabu̱ ra gabida ne ra malintzin ne ""ra jyadi"" (alvarado) ne ra sandoval."	"ebu̱ bi bo̱ni, bi meui nuni nonohualco, ha ra ngu ra b'ongui habu̱ ra gabida ne ra malintzin ne ""ra hyadi"" (alvarado) ne ra sandoval."	"ebu̱ bi bo̱ni, bi meui nuni nonohualco, ha ra ngu ra b'ongui habu̱ ra gabida ne ra malintzin ne ""ra hyadi"" (alvarado) ne ra sandoval."
despwés ya xo bimu̱phí pe xo diario diario bu̱ nchúi mitsu̱ k'a ra chařo mi'óbí k'a ra mikwála	despwés ya xo bimu̱fí pe xo diario diario bu̱ nchúi mitsu̱ k'a ra charro mi'óbí k'a ra mikwála	despwés ya xo bimu̱fí pe xo diario diario bu̱ nchúi mitsu̱ k'a ra charro mi'óbí k'a ra mikwála	despwés ya xo bimu̱fí pe xo diario diario bu̱ ntxúi mitsu̱ k'a ra txarro mi'óbí k'a ra mikwála
Ha nu'a hyodi nubia thutuabi ra San Martin.	ja nu'a jyodi nubia tjutuabi ra san martin.	ha nu'a hyodi nubia thutuabi ra san martin.	ha nu'a hyodi nubia thutuabi ra san martin.
"Ne mätahekitho di ja getbu̱, ra hñäpi ra Joel Martinez Hernández ne ra hotho thuahmä ra Natalio Hernández Xocoyotzin, nuya yoho ya xahnate ri ñ'ehe ya y'u̱ dige'u̱ ya ndeznä."	"ne mätajekitjo di ja getbu̱, ra jñäpi ra joel martinez hernández ne ra jotjo tjuajmä ra natalio hernández xocoyotzin, nuya yojo ya xajnate ri ñ'eje ya y'u̱ dige'u̱ ya ndeznä."	"ne mätahekitho di ja getbu̱, ra hñäpi ra joel martinez hernández ne ra hotho thuahmä ra natalio hernández xocoyotzin, nuya yoho ya xahnate ri ñ'ehe ya y'u̱ dige'u̱ ya ndeznä."	"ne mätahekitho di ja getbu̱, ra hñäpi ra joel martinez hernández ne ra hotho thuahmä ra natalio hernández xocoyotzin, nuya yoho ya xahnate ri ñ'ehe ya y'u̱ dige'u̱ ya ndeznä."
bu̱ xo ndímápe̱'ts'igó komo ocho o dies años bikhúgígó eskwéla pero ndichichithóhó	bu̱ xo ndímápe̱'ts'igó komo ocho o dies años bijúgígó eskwéla pero ndichichitjójó	bu̱ xo ndímápe̱'ts'igó komo ocho o dies años bijúgígó eskwéla pero ndichichithóhó	bu̱ xo ndímápe̱'ts'igó komo ocho o dies años bijúgígó eskwéla pero nditxitxithóhó
i asta fecha pues ignoro mucho pero másk'ŭ mäkhámá más ndímáignorahéwi	i asta fecha pues ignoro mucho pero másk'ŭ mäjámá más ndímáignorajéwi	i asta fecha pues ignoro mucho pero másk'ŭ mäjámá más ndímáignorahéwi	i asta fecha pues ignoro mucho pero másk'ŭ mäjámá más ndímáignorahéwi
"Ha ga ñ'udihu̱ ra nt'ofo ya ñämfo̱ po ra nthuts'i ra Doctor Garibay,"	"ja ga ñ'udiju̱ ra nt'ofo ya ñämfo̱ po ra ntjuts'i ra doctor garibay,"	"ha ga ñ'udihu̱ ra nt'ofo ya ñämfo̱ po ra nthuts'i ra doctor garibay,"	"ha ga ñ'udihu̱ ra nt'ofo ya ñämfo̱ po ra nthuts'i ra doctor garibay,"
panteón ga dó	panteón ga dó	panteón ga dó	panteón ga dó
"Ra Fernando de Alva Ixtlilxóchitl, Fernando de, XIII relación: ""ra ñ'ehe ya ñämfo̱ ne ra fu̱di ra nkanfri ra evangelio""."	"ra fernando de alva ixtlilxóchitl, fernando de, xiii relación: ""ra ñ'eje ya ñämfo̱ ne ra fu̱di ra nkanfri ra evangelio""."	"ra fernando de alva ixtlilxóchitl, fernando de, xiii relación: ""ra ñ'ehe ya ñämfo̱ ne ra fu̱di ra nkanfri ra evangelio""."	"ra fernando de alva ixtlilxótxitl, fernando de, xiii relación: ""ra ñ'ehe ya ñämfo̱ ne ra fu̱di ra nkanfri ra evangelio""."