id	Palabra	Aparece en:	OTS	INALI	OTQ	RFE	fon																		
113	njändahmä	Fernando Alva Ixtlilxóchitl, xiii njändahmä "ra ñ'ehe ya ñämfo̱ ne ra mu̱di ra hoga ts'ofo ra evangelio."	fernando alva ixtlilxóchitl, xiii nkjändajmä "ra ñ'eje ya ñämfo̱ ne ra mu̱di ra joga ts'ofo ra evangelio."	fernando alva ixtlilxóchitl, xiii njändahmä "ra ñ'ehe ya ñämfo̱ ne ra mu̱di ra hoga ts'ofo ra evangelio."	fernando alva ixtlilxótxitl, xiii njändahmä "ra ñ'ehe ya ñämfo̱ ne ra mu̱di ra hoga ts'ofo ra evangelio."	phernando alva ištlilšóčitl, šiii nkhᶏndahmᶏ "ra ñʔehe ya ñᶏmphɔ ne ra mɨdi ra hoga cʔopho ra evangelio."	ɸeɾnando alva iʃtlilʃót͡ʃitl, ʃiii nkhãndahmã "ɾa ɲʔehe ja ɲãmɸɔ ne ra mɨdi ra hoga t͡sʔoɸo ra ebangelio."																		
114	njändahmä	Bi tse̱ti nuna ngot'i ra M'onda, ngu pede ra Dänga B'ede, ya K'oi ne ya njändahmä, ngu nu'a ra hmä ra Alonso Axayaca, goho n'ate ma pa bi nzo̱t'e nuna pa.	bi tse̱ti nuna ngot'i ra m'onda, ngu pede ra dänga b'ede, ya k'oi ne ya nkjändajmä, ngu nu'a ra jmä ra alonso axayaca, gojo n'ate ma pa bi nzo̱t'e nuna pa.	bi tse̱ti nuna ngot'i ra m'onda, ngu pede ra dänga b'ede, ya k'oi ne ya njändahmä, ngu nu'a ra hmä ra alonso axayaca, goho n'ate ma pa bi nzo̱t'e nuna pa.	bi tse̱ti nuna ngot'i ra m'onda, ngu pede ra dänga b'ede, ya k'oi ne ya njändahmä, ngu nu'a ra hmä ra alonso axayaca, goho n'ate ma pa bi nzo̱t'e nuna pa.	bi cɛti nuna ngotʔi ra mʔonda, ngu pede ra dᶏnga bʔede, ya kʔoi ne ya nkhᶏndahmᶏ, ngu nuʔa ra hmᶏ ra alonso axayaca, goho nʔate ma pa bi nzɔtʔe nuna pa.	bi t͡sɛti nuna ngotʔi ra mʔonda, ngu pede ra dãnga bʔede, ja kʔoi ne ja nkhãndahmã, ngu nuʔa ra hmã ra alonso aʃajaka, goho nʔate ma pa bi nzɔtʔe nuna pa.																		
116	ajuähu̱	—Dom'i ma ajuähu̱ ge inda yu̱t'a ha ma nguhu̱ nuhu̱ to'o e̱nts'i pa thi ne da hokuabi ra honanhyo nub'u̱ sta ne da hyoki ya inda za.	-dom'i ma akjuäju̱ ge inda yu̱t'a ja ma nguju̱ nuju̱ to'o e̱nts'i pa tji ne da jokuabi ra jonanjyo nub'u̱ sta ne da jyoki ya inda za.	-dom'i ma ajuähu̱ ge inda yu̱t'a ha ma nguhu̱ nuhu̱ to'o e̱nts'i pa thi ne da hokuabi ra honanhyo nub'u̱ sta ne da hyoki ya inda za.	-dom'i ma ajuähu̱ ge inda yu̱t'a ha ma nguhu̱ nuhu̱ to'o e̱nts'i pa thi ne da hokuabi ra honanhyo nub'u̱ sta ne da hyoki ya inda za.	-domʔi ma akhuᶏhɨ ge inda yɨtʔa ha ma nguhɨ nuhɨ toʔo ɛncʔi pa thi ne da hokuabi ra honanhyo nubʔɨ sta ne da hyoki ya inda za.	-domʔi ma akhuãhɨ ge inda jɨtʔa ha ma nguhɨ nuhɨ toʔo ɛnt͡sʔi pa thi ne da hokuabi ra honanhjo nubʔɨ sta ne da hjoki ja inda za.																		
117	ajuähu̱	bi tso̱hso̱ ra ngo ma ajuähu̱: nubia da fu̱di da guadi ra r'e̱t'a ra pa.	bi tso̱jso̱ ra ngo ma akjuäju̱: nubia da fu̱di da guadi ra r'e̱t'a ra pa.	bi tso̱hso̱ ra ngo ma ajuähu̱: nubia da fu̱di da guadi ra r'e̱t'a ra pa.	bi tso̱hso̱ ra ngo ma ajuähu̱: nubia da fu̱di da guadi ra r'e̱t'a ra pa.	bi cɔhsɔ ra ngo ma akhuᶏhɨ: nubia da phɨdi da guadi ra rʔɛtʔa ra pa.	bi t͡sɔhsɔ ra ngo ma akhuãhɨ: nubia da ɸɨdi da guadi ra rʔɛtʔa ra pa.																		
118	japabihe	Da umbabihe te da zi, da japabihe ndunthi ma zu.	da umbabije te da zi, da kjapabije nduntji ma zu.	da umbabihe te da zi, da japabihe ndunthi ma zu.	da umbabihe te da zi, da japabihe ndunthi ma zu.	da umbabihe te da zi, da khapabihe ndunthi ma zu.	da umbabihe te da zi, da khapabihe ndunthi ma zu.																		
121	njondahmä	Ra nhñu ne ra ngästsi ra b'ist'ofo di huts'ihu̱ ha nuna ze̱ki b'ist'ofo, ri ñ'ehe ra VII njondahmä ra Chimalpain,	ra njñu ne ra ngästsi ra b'ist'ofo di juts'iju̱ ja nuna ze̱ki b'ist'ofo, ri ñ'eje ra vii nkjondajmä ra chimalpain,	ra nhñu ne ra ngästsi ra b'ist'ofo di huts'ihu̱ ha nuna ze̱ki b'ist'ofo, ri ñ'ehe ra vii njondahmä ra chimalpain,	ra nhñu ne ra ngästsi ra b'ist'ofo di huts'ihu̱ ha nuna ze̱ki b'ist'ofo, ri ñ'ehe ra vii njondahmä ra chimalpain,	ra nhñu ne ra ngᶏsci ra bʔistʔopho di hucʔihɨ ha nuna zɛki bʔistʔopho, ri ñʔehe ra vii nkhondahmᶏ ra chimalpain,	ra nhɲu ne ra ngãst͡si ra bʔistʔoɸo di hut͡sʔihɨ ha nuna zɛki bʔistʔoɸo, ri ɲʔehe ra vii nkhondahmã ra t͡ʃimalpain,																		
124	njondahmä	pa ga b'u̱i mpaha ne ga o̱t'e n'a ra njondahmä gatho nu'a ga handi.	pa ga b'u̱i mpaja ne ga o̱t'e n'a ra nkjondajmä gatjo nu'a ga jandi.	pa ga b'u̱i mpaha ne ga o̱t'e n'a ra njondahmä gatho nu'a ga handi.	pa ga b'u̱i mpaha ne ga o̱t'e n'a ra njondahmä gatho nu'a ga handi.	pa ga bʔɨi mpaha ne ga ɔtʔe nʔa ra nkhondahmᶏ gatho nuʔa ga handi.	pa ga bʔɨi mpaha ne ga ɔtʔe nʔa ra nkhondahmã gatho nuʔa ga handi.																		
127	johyahu̱,	Num'u̱ di johyahu̱, nkuehu̱, nts'o̱mihu̱, tsuhu ne pa da t'o̱xkähu̱ di hohñu̱ nu ya nt'u̱i xi di 'yoohu̱ (¡!). Nuya da nt'ot'i ko ra dänt'ot'i	num'u̱ di kjojyaju̱, nkueju̱, nts'o̱miju̱, tsuju ne pa da t'o̱xkäju̱ di jojñu̱ nu ya nt'u̱i xi di 'yooju̱ (¡!). nuya da nt'ot'i ko ra dänt'ot'í	num'u̱ di johyahu̱, nkuehu̱, nts'o̱mihu̱, tsuhu ne pa da t'o̱xkähu̱ di hohñu̱ nu ya nt'u̱i xi di 'yoohu̱ (¡!). nuya da nt'ot'i ko ra dänt'ot'í	num'u̱ di johyahu̱, nkuehu̱, nts'o̱mihu̱, tsuhu ne pa da t'o̱xkähu̱ di hohñu̱ nu ya nt'u̱i xi di 'yoohu̱ (¡!). nuya da nt'ot'i ko ra dänt'ot'í	numʔɨ di khohyahɨ, nkuehɨ, ncʔɔmihɨ, cuhu ne pa da tʔɔškᶏhɨ di hohñɨ nu ya ntʔɨi ši di ʔyoohɨ (¡!). nuya da ntʔotʔi ko ra dᶏntʔotʔí	numʔɨ di khohjahɨ, nkuehɨ, nt͡sʔɔmihɨ, t͡suhu ne pa da tʔɔʃkãhɨ di hohɲɨ nu ja ntʔɨi ʃi di ʔjoohɨ (¡!). nuja da ntʔotʔi ko ra dãntʔotʔí																		
128	¿hanja,	Pe, nu'i ndada nu'i ma t'ek'ei ra makja, nub'u̱ nu'i ingi zugagihe, ¿hanja, nuua, ra hyo di ge'a, ga tsogi nubu̱ [nu'a ma b'e̱hña]?	pe, nu'i ndada nu'i ma t'ek'ei ra makja, nub'u̱ nu'i ingi zugagije, ¿jankja, nuua, ra jyo di ge'a, ga tsogi nubu̱ [nu'a ma b'e̱jña]?	pe, nu'i ndada nu'i ma t'ek'ei ra makja, nub'u̱ nu'i ingi zugagihe, ¿hanja, nuua, ra hyo di ge'a, ga tsogi nubu̱ [nu'a ma b'e̱hña]?	pe, nu'i ndada nu'i ma t'ek'ei ra makja, nub'u̱ nu'i ingi zugagihe, ¿hanja, nuua, ra hyo di ge'a, ga tsogi nubu̱ [nu'a ma b'e̱hña]?	pe, nuʔi ndada nuʔi ma tʔekʔei ra makkha, nubʔɨ nuʔi ingi zugagihe, ¿hankha, nuua, ra hyo di geʔa, ga cogi nubɨ [nuʔa ma bʔɛhña]?	pe, nuʔi ndada nuʔi ma tʔekʔei ra makkha, nubʔɨ nuʔi ingi zugagihe, ¿hankha, nuua, ra hjo di geʔa, ga t͡sogi nubɨ [nuʔa ma bʔɛhɲa]?																		
129	manjuäntho,	Into y'o manjuäntho, into pa ri nektho.	into y'o manjuäntjo, into pa ri nektjo.	into y'o manjuäntho, into pa ri nektho.	into y'o manjuäntho, into pa ri nektho.	into yʔo mankhuᶏntho, into pa ri nektho.	into jʔo mankhuãntho, into pa ri nektho.																		
132	makjahe,	Ha nubia di ndäki, di ndändiñähmu, di ma ga ts'u̱tsa'i ri y'e, ga ndäne'i ra nge'a nu'a'i ma makjahe, ra Bartolomé López, nub'u̱ mi njuäni ma b'e̱hña inbi njuäni ha nubu̱ mi xaxi pa da o̱t'a ya tso̱mfen	ja nubia di ndäki, di ndändiñäjmu, di ma ga ts'u̱tsa'i ri y'e, ga ndäne'i ra nge'a nu'a'i ma makjaje, ra bartolomé lópez, nub'u̱ mi nkjuäni ma b'e̱jña inbi nkjuäni ja nubu̱ mi xaxi pa da o̱t'a ya tso̱mfen	ha nubia di ndäki, di ndändiñähmu, di ma ga ts'u̱tsa'i ri y'e, ga ndäne'i ra nge'a nu'a'i ma makjahe, ra bartolomé lópez, nub'u̱ mi njuäni ma b'e̱hña inbi njuäni ha nubu̱ mi xaxi pa da o̱t'a ya tso̱mfen	ha nubia di ndäki, di ndändiñähmu, di ma ga ts'u̱tsa'i ri y'e, ga ndäne'i ra nge'a nu'a'i ma makjahe, ra bartolomé lópez, nub'u̱ mi njuäni ma b'e̱hña inbi njuäni ha nubu̱ mi xaxi pa da o̱t'a ya tso̱mfen	ha nubia di ndᶏki, di ndᶏndiñᶏhmu, di ma ga cʔɨcaʔi ri yʔe, ga ndᶏneʔi ra ngeʔa nuʔaʔi ma makkhahe, ra bartolomé lópez, nubʔɨ mi nkhuᶏni ma bʔɛhña inbi nkhuᶏni ha nubɨ mi šaši pa da ɔtʔa ya cɔmphen	ha nubia di ndãki, di ndãndiɲãhmu, di ma ga t͡sʔɨt͡saʔi ri jʔe, ga ndãneʔi ra ngeʔa nuʔaʔi ma makkhahe, ra baɾtolomé lópez, nubʔɨ mi nkhuãni ma bʔɛhɲa inbi nkhuãni ha nubɨ mi ʃaʃi pa da ɔtʔa ja t͡sɔmɸen																		
133	njoho	Ra nyoho nu'a mi zu ra Tepoztlan; ra nhñu ra me Tizatlan, ra njoho mi ñ'ehe nuni Huehuetlan ne ra nku̱ta mra Dänga Mictlan.	ra nyojo nu'a mi zu ra tepoztlan; ra njñu ra me tizatlan, ra nkjojo mi ñ'eje nuni huehuetlan ne ra nku̱ta mra dänga mictlan.	ra nyoho nu'a mi zu ra tepoztlan; ra nhñu ra me tizatlan, ra njoho mi ñ'ehe nuni huehuetlan ne ra nku̱ta mra dänga mictlan.	ra nyoho nu'a mi zu ra tepoztlan; ra nhñu ra me tizatlan, ra njoho mi ñ'ehe nuni huehuetlan ne ra nku̱ta mra dänga mictlan.	ra nyoho nuʔa mi zu ra tepoztlan; ra nhñu ra me tizatlan, ra nkhoho mi ñʔehe nuni huehuetlan ne ra nkɨta mra dᶏnga mictlan.	ra njoho nuʔa mi zu ra tepoztlan; ra nhɲu ra me tizatlan, ra nkhoho mi ɲʔehe nuni huehuetlan ne ra nkɨta mɾa dãnga miktlan.																		
134	juähu̱?	—¿Nguande njabu̱ ga mäu gra juähu̱?	-¿nguande nkjabu̱ ga mäu gra kjuäju̱?	-¿nguande njabu̱ ga mäu gra juähu̱?	-¿nguande njabu̱ ga mäu gra juähu̱?	-¿nguande nkhabɨ ga mᶏu gra khuᶏhɨ?	-¿nguande nkhabɨ ga mãu gɾa khuãhɨ?																		
137	njot'ihñä	Da thuts'i ya njot'ihñä ( )	da tjuts'i ya nkjot'ijñä ( )	da thuts'i ya njot'ihñä ( )	da thuts'i ya njot'ihñä ( )	da thucʔi ya nkhotʔihñᶏ ( )	da thut͡sʔi ja nkhotʔihɲã ( )																		
138	jihni	Nuya tsat'io mi b'et'o, mi gu̱t'a ra ñ'u, mi teni, ya xiñu mi ju̱ts'i pa mañä, xi mi pähä gatho mi handi mi nest'ihi: mi tu̱ta ya jihni	nuya tsat'io mi b'et'o, mi gu̱t'a ra ñ'u, mi teni, ya xiñu mi kju̱ts'i pa mañä, xi mi päjä gatjo mi jandi mi nest'iji: mi tu̱ta ya kjijni	nuya tsat'io mi b'et'o, mi gu̱t'a ra ñ'u, mi teni, ya xiñu mi ju̱ts'i pa mañä, xi mi pähä gatho mi handi mi nest'ihi: mi tu̱ta ya jihni	nuya tsat'io mi b'et'o, mi gu̱t'a ra ñ'u, mi teni, ya xiñu mi ju̱ts'i pa mañä, xi mi pähä gatho mi handi mi nest'ihi: mi tu̱ta ya jihni	nuya catʔio mi bʔetʔo, mi gɨtʔa ra ñʔu, mi teni, ya šiñu mi khɨcʔi pa mañᶏ, ši mi pᶏhᶏ gatho mi handi mi nestʔihi: mi tɨta ya khihni	nuja t͡satʔio mi bʔetʔo, mi gɨtʔa ra ɲʔu, mi teni, ja ʃiɲu mi khɨt͡sʔi pa maɲã, ʃi mi pãhã gatho mi handi mi nestʔihi: mi tɨta ja khihni																		
139	manjuäntho.	Ra ngehna nuna pa bi ma n'a ra ñ'u manjuäntho.	ra ngejna nuna pa bi ma n'a ra ñ'u mankjuäntjo.	ra ngehna nuna pa bi ma n'a ra ñ'u manjuäntho.	ra ngehna nuna pa bi ma n'a ra ñ'u manjuäntho.	ra ngehna nuna pa bi ma nʔa ra ñʔu mankhuᶏntho.	ra ngehna nuna pa bi ma nʔa ra ɲʔu mankhuãntho.																		
140	hyotejä'i,	xa zägi mpaha, nub'u̱ xa njabu̱ xa japabi ma zu ne inte xa t'o̱tuabi nub'u̱ inda japi xa po̱ho̱ bi ya kue̱ ra nge'a ya jä'i xi mra no̱t'e ne mra hyotejä'i,	xa zägi mpaja, nub'u̱ xa nkjabu̱ xa kjapabi ma zu ne inte xa t'o̱tuabi nub'u̱ inda kjapi xa po̱jo̱ bi ya kue̱ ra nge'a ya kjä'i xi mra no̱t'e ne mra jyotekjä'i,	xa zägi mpaha, nub'u̱ xa njabu̱ xa japabi ma zu ne inte xa t'o̱tuabi nub'u̱ inda japi xa po̱ho̱ bi ya kue̱ ra nge'a ya jä'i xi mra no̱t'e ne mra hyotejä'i,	xa zägi mpaha, nub'u̱ xa njabu̱ xa japabi ma zu ne inte xa t'o̱tuabi nub'u̱ inda japi xa po̱ho̱ bi ya kue̱ ra nge'a ya jä'i xi mra no̱t'e ne mra hyotejä'i,	ša zᶏgi mpaha, nubʔɨ ša nkhabɨ ša khapabi ma zu ne inte ša tʔɔtuabi nubʔɨ inda khapi ša pɔhɔ bi ya kuɛ ra ngeʔa ya khᶏʔi ši mra nɔtʔe ne mra hyotekhᶏʔi,	ʃa zãgi mpaha, nubʔɨ ʃa nkhabɨ ʃa khapabi ma zu ne inte ʃa tʔɔtuabi nubʔɨ inda khapi ʃa pɔhɔ bi ja kuɛ ra ngeʔa ja khãʔi ʃi mɾa nɔtʔe ne mɾa hjotekhãʔi,																		
142	njamädihe.	—Xa hño, di b'u̠ihe njamädihe.	-xa jño, di b'u̱ije nkjamädije.	-xa hño, di b'u̱ihe njamädihe.	-xa hño, di b'u̱ihe njamädihe.	-ša hño, di bʔɨihe nkhamᶏdihe.	-ʃa hɲo, di bʔɨihe nkhamãdihe.																		
144	njondahmä.	Ha ya t'u̠ka ze̠ki thuts'i n'a tu̠kitho nuna thogi ge bi huxa ra Fernando Alva Ixtlilxóchitl, nu'a b'e̱tsi ra XIIIi njondahmä.	ja ya t'u̱ka ze̱ki tjuts'i n'a tu̱kitjo nuna tjogi ge bi juxa ra fernando alva ixtlilxóchitl, nu'a b'e̱tsi ra xiiii nkjondajmä.	ha ya t'u̱ka ze̱ki thuts'i n'a tu̱kitho nuna thogi ge bi huxa ra fernando alva ixtlilxóchitl, nu'a b'e̱tsi ra xiiii njondahmä.	ha ya t'u̱ka ze̱ki thuts'i n'a tu̱kitho nuna thogi ge bi huxa ra fernando alva ixtlilxóchitl, nu'a b'e̱tsi ra xiiii njondahmä.	ha ya tʔɨka zɛki thucʔi nʔa tɨkitho nuna thogi ge bi huša ra phernando alva ištlilšóčitl, nuʔa bʔɛci ra šiiii nkhondahmᶏ.	ha ja tʔɨka zɛki thut͡sʔi nʔa tɨkitho nuna thogi ge bi huʃa ra feɾnando alva iʃtlilʃót͡ʃitl, nuʔa bʔɛt͡si ra ʃiiii nkhondahmã.																		
145	nzo̱ho̱jä'i	mi mä dega ts'e̱dira hñä tso̱pu da ts'o̱ho̱bu nuya nzo̱ho̱jä'i ga handihu̱ te ma ts'e̱di pe̱tsi, ra nge'a ma ajuä ra Quetzalcohuatl b'u̱i nuua ko ngekagihu̱,	mi mä dega ts'e̱dira jñä tso̱pu da ts'o̱jo̱bu nuya nzo̱jo̱kjä'i ga jandiju̱ te ma ts'e̱di pe̱tsi, ra nge'a ma akjuä ra quetzalcohuatl b'u̱i nuua ko ngekagiju̱,	mi mä dega ts'e̱dira hñä tso̱pu da ts'o̱ho̱bu nuya nzo̱ho̱jä'i ga handihu̱ te ma ts'e̱di pe̱tsi, ra nge'a ma ajuä ra quetzalcohuatl b'u̱i nuua ko ngekagihu̱,	mi mä dega ts'e̱dira hñä tso̱pu da ts'o̱ho̱bu nuya nzo̱ho̱jä'i ga handihu̱ te ma ts'e̱di pe̱tsi, ra nge'a ma ajuä ra quetzalcohuatl b'u̱i nuua ko ngekagihu̱,	mi mᶏ dega cʔɛdira hñᶏ cɔpu da cʔɔhɔbu nuya nzɔhɔkhᶏʔi ga handihɨ te ma cʔɛdi pɛci, ra ngeʔa ma akhuᶏ ra quetzalcohuatl bʔɨi nuua ko ngekagihɨ,	mi mã dega t͡sʔɛdiɾa hɲã t͡sɔpu da t͡sʔɔhɔbu nuja nzɔhɔkhãʔi ga handihɨ te ma t͡sʔɛdi pɛt͡si, ra ngeʔa ma akhuã ra quetzalkohuatl bʔɨi nuua ko ngekagihɨ,																		
146	njueih'u̱.	—Da ts'iua:... ri ñ'ehe ge'a ma njueih'u̱. Da o̱t'ehe ya ñ'o̱te ko ya he̱m'i, ya ñ'o̱t'ehe ko ya ntuts'i. Da o̱ts'e̱ ra b'e̱na noya.	-da ts'iua:... ri ñ'eje ge'a ma nkjueij'u̱. da o̱t'eje ya ñ'o̱te ko ya je̱m'i, ya ñ'o̱t'eje ko ya ntuts'i. da o̱ts'e̱ ra b'e̱na noya.	-da ts'iua:... ri ñ'ehe ge'a ma njueih'u̱. da o̱t'ehe ya ñ'o̱te ko ya he̱m'i, ya ñ'o̱t'ehe ko ya ntuts'i. da o̱ts'e̱ ra b'e̱na noya.	-da ts'iua:... ri ñ'ehe ge'a ma njueih'u̱. da o̱t'ehe ya ñ'o̱te ko ya he̱m'i, ya ñ'o̱t'ehe ko ya ntuts'i. da o̱ts'e̱ ra b'e̱na noya.	-da cʔiua:... ri ñʔehe geʔa ma nkhueihʔɨ. da ɔtʔehe ya ñʔɔte ko ya hɛmʔi, ya ñʔɔtʔehe ko ya ntucʔi. da ɔcʔɛ ra bʔɛna noya.	-da t͡sʔiua:... ri ɲʔehe geʔa ma nkhueihʔɨ. da ɔtʔehe ja ɲʔɔte ko ja hɛmʔi, ja ɲʔɔtʔehe ko ja ntut͡sʔi. da ɔt͡sʔɛ ra bʔɛna noja.																		
147	manjuänthä.	Ra nge'a di o̱t'a nuna noya ra ts'u̱tui ne gatho to'o da guat'a ha ma hyohe, nu'u̱ to'o da ne, da me̱tsi n'a ra hoga m'u̱i ne da m'u̱i manjuänthä. Ha nubu̱ xa mabu̱ ma noya ge di pe̱tsi ra tsa, dega hoga jä'i ne dega hogat'o̱t'antuhni	ra nge'a di o̱t'a nuna noya ra ts'u̱tui ne gatjo to'o da guat'a ja ma jyoje, nu'u̱ to'o da ne, da me̱tsi n'a ra joga m'u̱i ne da m'u̱i mankjuäntjä. ja nubu̱ xa mabu̱ ma noya ge di pe̱tsi ra tsa, dega joga kjä'i ne dega jogat'o̱t'antujni	ra nge'a di o̱t'a nuna noya ra ts'u̱tui ne gatho to'o da guat'a ha ma hyohe, nu'u̱ to'o da ne, da me̱tsi n'a ra hoga m'u̱i ne da m'u̱i manjuänthä. ha nubu̱ xa mabu̱ ma noya ge di pe̱tsi ra tsa, dega hoga jä'i ne dega hogat'o̱t'antuhni	ra nge'a di o̱t'a nuna noya ra ts'u̱tui ne gatho to'o da guat'a ha ma hyohe, nu'u̱ to'o da ne, da me̱tsi n'a ra hoga m'u̱i ne da m'u̱i manjuänthä. ha nubu̱ xa mabu̱ ma noya ge di pe̱tsi ra tsa, dega hoga jä'i ne dega hogat'o̱t'antuhni	ra ngeʔa di ɔtʔa nuna noya ra cʔɨtui ne gatho toʔo da guatʔa ha ma hyohe, nuʔɨ toʔo da ne, da mɛci nʔa ra hoga mʔɨi ne da mʔɨi mankhuᶏnthᶏ. ha nubɨ ša mabɨ ma noya ge di pɛci ra ca, dega hoga khᶏʔi ne dega hogatʔɔtʔantuhni	ra ngeʔa di ɔtʔa nuna noja ra t͡sʔɨtui ne gatho toʔo da guatʔa ha ma hjohe, nuʔɨ toʔo da ne, da mɛt͡si nʔa ra hoga mʔɨi ne da mʔɨi mankhuãnthã. ha nubɨ ʃa mabɨ ma noja ge di pɛt͡si ra t͡sa, dega hoga khãʔi ne dega hogatʔɔtʔantuhni																		
148	njagihu̱	ha mi tso nde, bi mu̱di bi nja n'a ra hneki ngu njagihu̱ dega jä'i, bi t'ot'e ra b'ai ngu dega jä'i,	ja mi tso nde, bi mu̱di bi nkja n'a ra jneki ngu nkjagiju̱ dega kjä'i, bi t'ot'e ra b'ai ngu dega kjä'i,	ha mi tso nde, bi mu̱di bi nja n'a ra hneki ngu njagihu̱ dega jä'i, bi t'ot'e ra b'ai ngu dega jä'i,	ha mi tso nde, bi mu̱di bi nja n'a ra hneki ngu njagihu̱ dega jä'i, bi t'ot'e ra b'ai ngu dega jä'i,	ha mi co nde, bi mɨdi bi nkha nʔa ra hneki ngu nkhagihɨ dega khᶏʔi, bi tʔotʔe ra bʔai ngu dega khᶏʔi,	ha mi t͡so nde, bi mɨdi bi nkha nʔa ra hneki ngu nkhagihɨ dega khãʔi, bi tʔotʔe ra bʔai ngu dega khãʔi,																		
150	njut'ihe	Nub'u̱ ndi umbabihe ma njut'ihe xki nzäi ndi da'ihe, mi adi n'a tu̱ki nehe nub'u̱ ndi unihe ya k'astaboja mi häni made n'a tu̱ki [...]	nub'u̱ ndi umbabije ma nkjut'ije xki nzäi ndi da'ije, mi adi n'a tu̱ki neje nub'u̱ ndi unije ya k'astaboja mi kjäni made n'a tu̱ki [...]	nub'u̱ ndi umbabihe ma njut'ihe xki nzäi ndi da'ihe, mi adi n'a tu̱ki nehe nub'u̱ ndi unihe ya k'astaboja mi häni made n'a tu̱ki [...]	nub'u̱ ndi umbabihe ma njut'ihe xki nzäi ndi da'ihe, mi adi n'a tu̱ki nehe nub'u̱ ndi unihe ya k'astaboja mi häni made n'a tu̱ki [...]	nubʔɨ ndi umbabihe ma nkhutʔihe ški nzᶏi ndi daʔihe, mi adi nʔa tɨki nehe nubʔɨ ndi unihe ya kʔastabokha mi hᶏni made nʔa tɨki [...]	nubʔɨ ndi umbabihe ma nkhutʔihe ʃki nzãi ndi daʔihe, mi adi nʔa tɨki nehe nubʔɨ ndi unihe ja kʔastabokha mi hãni made nʔa tɨki [...]																		
151	jihu̱,	Njabu̱ ri ñ'ehe ya je̱ya inda m'e̱di, inda mpumfri, ga nzäi ga pe̱tsi nugagihu̱ ha ma mfenihu̱, ga pe̱tsi nugagihu̱, ra bätsi dige'u̱, ya b'e̱to, ya ntsaniku, ya mbänga b'e̱to ne to'o dra ñ'epu̱, to'o mahye̱gigihu̱, ma jihu̱, ya ku̱hu̱.	nkjabu̱ ri ñ'eje ya kje̱ya inda m'e̱di, inda mpumfri, ga nzäi ga pe̱tsi nugagiju̱ ja ma mfeniju̱, ga pe̱tsi nugagiju̱, ra bätsi dige'u̱, ya b'e̱to, ya ntsaniku, ya mbänga b'e̱to ne to'o dra ñ'epu̱, to'o majye̱gigiju̱, ma kjiju̱, ya ku̱ju̱.	njabu̱ ri ñ'ehe ya je̱ya inda m'e̱di, inda mpumfri, ga nzäi ga pe̱tsi nugagihu̱ ha ma mfenihu̱, ga pe̱tsi nugagihu̱, ra bätsi dige'u̱, ya b'e̱to, ya ntsaniku, ya mbänga b'e̱to ne to'o dra ñ'epu̱, to'o mahye̱gigihu̱, ma jihu̱, ya ku̱hu̱.	njabu̱ ri ñ'ehe ya je̱ya inda m'e̱di, inda mpumfri, ga nzäi ga pe̱tsi nugagihu̱ ha ma mfenihu̱, ga pe̱tsi nugagihu̱, ra bätsi dige'u̱, ya b'e̱to, ya ntsaniku, ya mbänga b'e̱to ne to'o dra ñ'epu̱, to'o mahye̱gigihu̱, ma jihu̱, ya ku̱hu̱.	nkhabɨ ri ñʔehe ya khɛya inda mʔɛdi, inda mpumphri, ga nzᶏi ga pɛci nugagihɨ ha ma mphenihɨ, ga pɛci nugagihɨ, ra bᶏci digeʔɨ, ya bʔɛto, ya ncaniku, ya mbᶏnga bʔɛto ne toʔo dra ñʔepɨ, toʔo mahyɛgigihɨ, ma khihɨ, ya kɨhɨ.	nkhabɨ ri ɲʔehe ja khɛja inda mʔɛdi, inda mpumɸɾi, ga nzãi ga pɛt͡si nugagihɨ ha ma mɸenihɨ, ga pɛt͡si nugagihɨ, ra bãt͡si digeʔɨ, ja bʔɛto, ja nt͡saniku, ja mbãnga bʔɛto ne toʔo dɾa ɲʔepɨ, toʔo mahjɛgigihɨ, ma khihɨ, ja kɨhɨ.																		
152	jä'ihu̠	—Ñ'emabagi, ya gabida, ya jä'ihu̠ gi pädi ra ntuni ra mem'onda ba ehehu̠ ga te̠nihu̠ma nzu̠tehu̠. Ko ya mätsa mi te̠he̠, ko ya bu̠'bai ko ngatho ra ts'e̱di mi te̠he̠ ra ñ'u.	-ñ'emabagi, ya gabida, ya kjä'iju̱ gi pädi ra ntuni ra mem'onda ba ejeju̱ ga te̱niju̱ma nzu̱teju̱. ko ya mätsa mi te̱je̱, ko ya bu̱'bai ko ngatjo ra ts'e̱di mi te̱je̱ ra ñ'u.	-ñ'emabagi, ya gabida, ya jä'ihu̱ gi pädi ra ntuni ra mem'onda ba ehehu̱ ga te̱nihu̱ma nzu̱tehu̱. ko ya mätsa mi te̱he̱, ko ya bu̱'bai ko ngatho ra ts'e̱di mi te̱he̱ ra ñ'u.	-ñ'emabagi, ya gabida, ya jä'ihu̱ gi pädi ra ntuni ra mem'onda ba ehehu̱ ga te̱nihu̱ma nzu̱tehu̱. ko ya mätsa mi te̱he̱, ko ya bu̱'bai ko ngatho ra ts'e̱di mi te̱he̱ ra ñ'u.	-ñʔemabagi, ya gabida, ya khᶏʔihɨ gi pᶏdi ra ntuni ra memʔonda ba ehehɨ ga tɛnihɨma nzɨtehɨ. ko ya mᶏca mi tɛhɛ, ko ya bɨʔbai ko ngatho ra cʔɛdi mi tɛhɛ ra ñʔu.	-ɲʔemabagi, ja gabida, ja khãʔihɨ gi pãdi ra ntuni ra memʔonda ba ehehɨ ga tɛnihɨma nzɨtehɨ. ko ja mãt͡sa mi tɛhɛ, ko ja bɨʔbai ko ngatho ra t͡sʔɛdi mi tɛhɛ ra ɲʔu.																		
153	njändahmä,	Bi tse̱ti nuna ngot'i ra M'onda, ngu pede ra Dänga B'ede, ya K'oi ne ya njändahmä, ngu nu'a ra hmä ra Alonso Axayaca, goho n'ate ma pa bi nzo̱t'e nuna pa.	bi tse̱ti nuna ngot'i ra m'onda, ngu pede ra dänga b'ede, ya k'oi ne ya nkjändajmä, ngu nu'a ra jmä ra alonso axayaca, gojo n'ate ma pa bi nzo̱t'e nuna pa.	bi tse̱ti nuna ngot'i ra m'onda, ngu pede ra dänga b'ede, ya k'oi ne ya njändahmä, ngu nu'a ra hmä ra alonso axayaca, goho n'ate ma pa bi nzo̱t'e nuna pa.	bi tse̱ti nuna ngot'i ra m'onda, ngu pede ra dänga b'ede, ya k'oi ne ya njändahmä, ngu nu'a ra hmä ra alonso axayaca, goho n'ate ma pa bi nzo̱t'e nuna pa.	bi cɛti nuna ngotʔi ra mʔonda, ngu pede ra dᶏnga bʔede, ya kʔoi ne ya nkhᶏndahmᶏ, ngu nuʔa ra hmᶏ ra alonso axayaca, goho nʔate ma pa bi nzɔtʔe nuna pa.	bi t͡sɛti nuna ngotʔi ra mʔonda, ngu pede ra dãnga bʔede, ja kʔoi ne ja nkhãndahmã, ngu nuʔa ra hmã ra alonso aʃajaka, goho nʔate ma pa bi nzɔtʔe nuna pa.																		
154	njom'ahudi.	Ya zi b'e̱hña mi ägi ha ya b'a ne ha ya ngo̱de, nuya ñ'o̱ho̱ mbo ha ya ne, ha ya njom'ahudi.	ya zi b'e̱jña mi ägi ja ya b'a ne ja ya ngo̱de, nuya ñ'o̱jo̱ mbo ja ya ne, ja ya nkjom'ajudi.	ya zi b'e̱hña mi ägi ha ya b'a ne ha ya ngo̱de, nuya ñ'o̱ho̱ mbo ha ya ne, ha ya njom'ahudi.	ya zi b'e̱hña mi ägi ha ya b'a ne ha ya ngo̱de, nuya ñ'o̱ho̱ mbo ha ya ne, ha ya njom'ahudi.	ya zi bʔɛhña mi ᶏgi ha ya bʔa ne ha ya ngɔde, nuya ñʔɔhɔ mbo ha ya ne, ha ya nkhomʔahudi.	ja zi bʔɛhɲa mi ãgi ha ja bʔa ne ha ja ngɔde, nuja ɲʔɔhɔ mbo ha ja ne, ha ja nkhomʔahudi.																		
155	hyoyajä'i	Gatho ya hyoyajä'i mi b'u̱i ha ra hnini bi handi.	gatjo ya jyoyakjä'i mi b'u̱i ja ra jnini bi jandi.	gatho ya hyoyajä'i mi b'u̱i ha ra hnini bi handi.	gatho ya hyoyajä'i mi b'u̱i ha ra hnini bi handi.	gatho ya hyoyakhᶏʔi mi bʔɨi ha ra hnini bi handi.	gatho ja hjojakhãʔi mi bʔɨi ha ra hnini bi handi.																		
156	ajuähu̱:	bi tso̱hso̱ ra ngo ma ajuähu̱: nubia da fu̱di da guadi ra r'e̱t'a ra pa.	bi tso̱jso̱ ra ngo ma akjuäju̱: nubia da fu̱di da guadi ra r'e̱t'a ra pa.	bi tso̱hso̱ ra ngo ma ajuähu̱: nubia da fu̱di da guadi ra r'e̱t'a ra pa.	bi tso̱hso̱ ra ngo ma ajuähu̱: nubia da fu̱di da guadi ra r'e̱t'a ra pa.	bi cɔhsɔ ra ngo ma akhuᶏhɨ: nubia da phɨdi da guadi ra rʔɛtʔa ra pa.	bi t͡sɔhsɔ ra ngo ma akhuãhɨ: nubia da ɸɨdi da guadi ra rʔɛtʔa ra pa.																		
157	ajuähe.	—O̱t'a ra mäte gi o̱dehu̱, ja gi b'ai nuuahu̱. Mont'a ya ngo Ajuä; ri juat'i ra ngo ga tsunda ma ajuähe.	-o̱t'a ra mäte gi o̱deju̱, kja gi b'ai nuuaju̱. mont'a ya ngo akjuä; ri kjuat'i ra ngo ga tsunda ma akjuäje.	-o̱t'a ra mäte gi o̱dehu̱, ja gi b'ai nuuahu̱. mont'a ya ngo ajuä; ri juat'i ra ngo ga tsunda ma ajuähe.	-o̱t'a ra mäte gi o̱dehu̱, ja gi b'ai nuuahu̱. mont'a ya ngo ajuä; ri juat'i ra ngo ga tsunda ma ajuähe.	-ɔtʔa ra mᶏte gi ɔdehɨ, kha gi bʔai nuuahɨ. montʔa ya ngo akhuᶏ; ri khuatʔi ra ngo ga cunda ma akhuᶏhe.	-ɔtʔa ra mãte gi ɔdehɨ, kha gi bʔai nuuahɨ. montʔa ja ngo akhuã; ri khuatʔi ra ngo ga t͡sunda ma akhuãhe.																		
158	ju̱t'atho.	Xi mi taxki ra ñ'u, imbi tsa da r'anga n'a, ho̱nse̱he̱ mi taxka n'a ha ra bo̱hai. Ya y'ofadi mi ju̱t'atho.	xi mi taxki ra ñ'u, imbi tsa da r'anga n'a, jo̱nse̱je̱ mi taxka n'a ja ra bo̱jai. ya y'ofadi mi kju̱t'atjo.	xi mi taxki ra ñ'u, imbi tsa da r'anga n'a, ho̱nse̱he̱ mi taxka n'a ha ra bo̱hai. ya y'ofadi mi ju̱t'atho.	xi mi taxki ra ñ'u, imbi tsa da r'anga n'a, ho̱nse̱he̱ mi taxka n'a ha ra bo̱hai. ya y'ofadi mi ju̱t'atho.	ši mi taški ra ñʔu, imbi ca da rʔanga nʔa, hɔnsɛhɛ mi taška nʔa ha ra bɔhai. ya yʔophadi mi khɨtʔatho.	ʃi mi taʃki ra ɲʔu, imbi t͡sa da rʔanga nʔa, hɔnsɛhɛ mi taʃka nʔa ha ra bɔhai. ja jʔoɸadi mi khɨtʔatho.																		
160	jäpadehe	Nuya hñu o gohoya pa bi b'u̱i nubu̱ bi xitsuabi ra jäpadehe ndunthi ya jä'i, ngu xa t'ena.	nuya jñu o gojoya pa bi b'u̱i nubu̱ bi xitsuabi ra kjäpadeje nduntji ya kjä'i, ngu xa t'ena.	nuya hñu o gohoya pa bi b'u̱i nubu̱ bi xitsuabi ra jäpadehe ndunthi ya jä'i, ngu xa t'ena.	nuya hñu o gohoya pa bi b'u̱i nubu̱ bi xitsuabi ra jäpadehe ndunthi ya jä'i, ngu xa t'ena.	nuya hñu o gohoya pa bi bʔɨi nubɨ bi šicuabi ra khᶏpadehe ndunthi ya khᶏʔi, ngu ša tʔena.	nuja hɲu o gohoja pa bi bʔɨi nubɨ bi ʃit͡suabi ra khãpadehe ndunthi ja khãʔi, ngu ʃa tʔena.																		
161	ñ'jähu̱	Nu xä oth'u̱, ma gä ñ'jähu̱	nu xä otj'u̱, ma gä ñ'kjäju̱	nu xä oth'u̱, ma gä ñ'jähu̱	nu xä oth'u̱, ma gä ñ'jähu̱	nu šᶏ othʔɨ, ma gᶏ ñʔkhᶏhɨ	nu ʃã othʔɨ, ma gã ɲʔkhãhɨ																		
