id	Palabra	Aparece en:	OTS	INALI	OTQ	RFE	fon																		
2	johya	Ngu mra me̱ti, nu'a r'a hyodi, habu mi y'o, n'a ngu n'a mi johya mi mfe̱m'a xinxi xi mi johya ya ndäte, mi thede n'a ngu n'a mi hñu̱fi ne mi fe̱m'a ya xinxi: xi mi b'u̱i mpaha.	ngu mra me̱ti, nu'a r'a hyodi, jabu mi y'o, n'a ngu n'a mi kjohya mi mfe̱m'a xinxi xi mi kjohya ya ndäte, mi tjede n'a ngu n'a mi jñu̱fi ne mi fe̱m'a ya xinxi: xi mi b'u̱i mpaja.	ngu mra me̱ti, nu'a r'a hyodi, habu mi y'o, n'a ngu n'a mi johya mi mfe̱m'a xinxi xi mi johya ya ndäte, mi thede n'a ngu n'a mi hñu̱fi ne mi fe̱m'a ya xinxi: xi mi b'u̱i mpaha.	ngu mra me̱ti, nu'a r'a hyodi, habu mi y'o, n'a ngu n'a mi johya mi mfe̱m'a xinxi xi mi johya ya ndäte, mi thede n'a ngu n'a mi hñu̱fi ne mi fe̱m'a ya xinxi: xi mi b'u̱i mpaha.	ngu mra mɛti, nuʔa rʔa hyodi, habu mi yʔo, nʔa ngu nʔa mi khohya mi mphɛmʔa šinši ši mi khohya ya ndᶏte, mi thede nʔa ngu nʔa mi hñɨphi ne mi phɛmʔa ya šinši: ši mi bʔɨi mpaha.	ngu mɾa mɛti, nuʔa rʔa hjodi, habu mi jʔo, nʔa ngu nʔa mi khohja mi mɸɛmʔa ʃinʃi ʃi mi khohja ja ndãte, mi thede nʔa ngu nʔa mi hɲɨɸi ne mi ɸɛmʔa ja ʃinʃi: ʃi mi bʔɨi mpaha.																		
3	johya	Ebu̱ bi mä nuna b'e̱fi xa thoki xahño bi johya ra Ts'e̱y'e̱hmu.	ebu̱ bi mä nuna b'e̱fi xa tjoki xajño bi kjohya ra ts'e̱y'e̱jmu.	ebu̱ bi mä nuna b'e̱fi xa thoki xahño bi johya ra ts'e̱y'e̱hmu.	ebu̱ bi mä nuna b'e̱fi xa thoki xahño bi johya ra ts'e̱y'e̱hmu.	ebɨ bi mᶏ nuna bʔɛphi ša thoki šahño bi khohya ra cʔɛyʔɛhmu.	ebɨ bi mã nuna bʔɛɸi ʃa thoki ʃahɲo bi khohja ra t͡sʔɛjʔɛhmu.																		
4	johya	Nuna bi johya ha ra mabagi,	nuna bi kjojya ja ra mabagi,	nuna bi johya ha ra mabagi,	nuna bi johya ha ra mabagi,	nuna bi khohya ha ra mabagi,	nuna bi khohja ha ra mabagi,																		
15	johya	Ya miñ'o ko ngehna hmä ri johya,	ya miñ'o ko ngejna jmä ri kjojya,	ya miñ'o ko ngehna hmä ri johya,	ya miñ'o ko ngehna hmä ri johya,	ya miñʔo ko ngehna hmᶏ ri khohya,	ja miɲʔo ko ngehna hmã ri khohja,																		
19	hanja	Ri ñ'udi xahño nubia hanja beni ya metlaxcala bi do̱m'i mpaha nuya nso̱ho̱ jä'i.	ri ñ'udi xajño nubia jankja beni ya metlaxcala bi do̱m'i mpaja nuya nso̱jo̱ kjä'i.	ri ñ'udi xahño nubia hanja beni ya metlaxcala bi do̱m'i mpaha nuya nso̱ho̱ jä'i.	ri ñ'udi xahño nubia hanja beni ya metlaxcala bi do̱m'i mpaha nuya nso̱ho̱ jä'i.	ri ñʔudi šahño nubia hankha beni ya metlaškala bi dɔmʔi mpaha nuya nsɔhɔ khᶏʔi.	ri ɲʔudi ʃahɲo nubia hankha beni ja metlaʃkala bi dɔmʔi mpaha nuja nsɔhɔ khãʔi.																		
20	hanja	Ya r'atsanoya ra Sahagún mi mä hanja mi yopa tsini. Ya ndeznä bi nkohi inda ñ'udi. Mi hatatho pa bi mu̠di ra ntuhni	ya r'atsanoya ra sajagún mi mä jankja mi yopa tsini. ya ndeznä bi nkoji inda ñ'udi. mi jatatjo pa bi mu̱di ra ntujni	ya r'atsanoya ra sahagún mi mä hanja mi yopa tsini. ya ndeznä bi nkohi inda ñ'udi. mi hatatho pa bi mu̱di ra ntuhni	ya r'atsanoya ra sahagún mi mä hanja mi yopa tsini. ya ndeznä bi nkohi inda ñ'udi. mi hatatho pa bi mu̱di ra ntuhni	ya rʔacanoya ra sahagún mi mᶏ hankha mi yopa cini. ya ndeznᶏ bi nkohi inda ñʔudi. mi hatatho pa bi mɨdi ra ntuhni	ja rʔat͡sanoja ra sahagún mi mã hankha mi jopa t͡sini. ja ndeznã bi nkohi inda ɲʔudi. mi hatatho pa bi mɨdi ra ntuhni																		
25	hanja	ne ya nt'u̱i, hanja di thuts'i ya nt'ofo, njap'u̱ nehe mä 'ra ya mpeu̱i da fats'i di nt'ot'i ra hñähñu	ne ya nt'u̱i, jankja di tjuts'i ya nt'ofo, nkjap'u̱ neje mä 'ra ya mpeu̱i da fats'i di nt'ot'i ra jñäjñu	ne ya nt'u̱i, hanja di thuts'i ya nt'ofo, njap'u̱ nehe mä 'ra ya mpeu̱i da fats'i di nt'ot'i ra hñähñu	ne ya nt'u̱i, hanja di thuts'i ya nt'ofo, njap'u̱ nehe mä 'ra ya mpeu̱i da fats'i di nt'ot'i ra hñähñu	ne ya ntʔɨi, hankha di thucʔi ya ntʔopho, nkhapʔɨ nehe mᶏ ʔra ya mpeɨi da phacʔi di ntʔotʔi ra hñᶏhñu	ne ja ntʔɨi, hankha di thut͡sʔi ja ntʔoɸo, nkhapʔɨ nehe mã ʔɾa ja mpeɨi da ɸat͡sʔi di ntʔotʔi ra hɲãhɲu																		
53	juahni	bri juahni po nuya dra hmu.	bri kjuajni po nuya dra jmu.	bri juahni po nuya dra hmu.	bri juahni po nuya dra hmu.	bri khuahni po nuya dra hmu.	bɾi khuahni po nuja dɾa hmu.																		
54	juahni	Ge mä ra bonahmu metetzcoco ge, enfrentar ra Cacamatzin, bi juahni bi fats'i ra Cortés.	ge mä ra bonajmu metetzcoco ge, enfrentar ra cacmatzin, bi kjuajni bi fats'i ra cortés.	ge mä ra bonahmu metetzcoco ge, enfrentar ra cacamatzin, bi juahni bi fats'i ra cortés.	ge mä ra bonahmu metetzcoco ge, enfrentar ra cacamatzin, bi juahni bi fats'i ra cortés.	ge mᶏ ra bonahmu metetzcoco ge, enphrentar ra cacamatzin, bi khuahni bi phacʔi ra cortés.	ge mã ra bonahmu metetzkoko ge, enfɾentaɾ ra kakamatzin, bi khuahni bi ɸat͡sʔi ra koɾtés.																		
57	thänjuahu̱	r'a nuna mi nthandi ngu nu'a ma thänjuahu̱ (Ychtlilmatli), xi mra nts'o, mi kuet'e ha ya ngo̱,	r'a nuna mi ntjandi ngu nu'a ma tjänkjuaju̱ (ychtlilmatli), xi mra nts'o, mi kuet'e ja ya ngo̱,	r'a nuna mi nthandi ngu nu'a ma thänjuahu̱ (ychtlilmatli), xi mra nts'o, mi kuet'e ha ya ngo̱,	r'a nuna mi nthandi ngu nu'a ma thänjuahu̱ (ytxtlilmatli), xi mra nts'o, mi kuet'e ha ya ngo̱,	rʔa nuna mi nthandi ngu nuʔa ma thᶏnkhuahɨ (yčtlilmatli), ši mra ncʔo, mi kuetʔe ha ya ngɔ,	rʔa nuna mi nthandi ngu nuʔa ma thãnkhuahɨ (it͡ʃtlilmatli), ʃi mɾa nt͡sʔo, mi kuetʔe ha ja ngɔ,																		
58	¿hanja	nub'u̱ nu'i ingi japi da bo̱nga nu'a ra makja ha nu'a ra hnini, ¿hanja ra yotui, ga tso̱gi nubu̱ ma b'e̱hña? O̱t'a r'ato ya je̱ya bi mu̱di [ra makja ra Bartolomé López]	nub'u̱ nu'i ingi kjapi da bo̱nga nu'a ra makja ja nu'a ra jnini, ¿jankja ra yotui, ga tso̱gi nubu̱ ma b'e̱jña? o̱t'a r'ato ya kje̱ya bi mu̱di [ra makja ra bartolomé lópez]	nub'u̱ nu'i ingi japi da bo̱nga nu'a ra makja ha nu'a ra hnini, ¿hanja ra yotui, ga tso̱gi nubu̱ ma b'e̱hña? o̱t'a r'ato ya je̱ya bi mu̱di [ra makja ra bartolomé lópez]	nub'u̱ nu'i ingi japi da bo̱nga nu'a ra makja ha nu'a ra hnini, ¿hanja ra yotui, ga tso̱gi nubu̱ ma b'e̱hña? o̱t'a r'ato ya je̱ya bi mu̱di [ra makja ra bartolomé lópez]	nubʔɨ nuʔi ingi khapi da bɔnga nuʔa ra makkha ha nuʔa ra hnini, ¿hankha ra yotui, ga cɔgi nubɨ ma bʔɛhña? ɔtʔa rʔato ya khɛya bi mɨdi [ra makkha ra bartolomé lópez]	nubʔɨ nuʔi ingi khapi da bɔnga nuʔa ra makkha ha nuʔa ra hnini, ¿hankha ra jotui, ga t͡sɔgi nubɨ ma bʔɛhɲa? ɔtʔa rʔato ja khɛja bi mɨdi [ɾa makkha ra baɾtolomé lópez]																		
62	hjua	bi boxro xi 'be̱ts'ina, bido'u̱ ro 'yu̱ni 'na, xi bi bo̱x ro hjua 'na, bido'u̱ ro ts'ii 'na, xi bo̱xro ts'äre 'na. Ge'bu̱ go min pu̱n doja 'na.	bi boxro xi 'be̱ts'ina, bido'u̱ ro 'yu̱ni 'na, xi bi bo̱x ro hkjua 'na, bido'u̱ ro ts'ii 'na, xi bo̱xro ts'äre 'na. ge'bu̱ go min pu̱n doja 'na.	bi boxro xi 'be̱ts'ina, bido'u̱ ro 'yu̱ni 'na, xi bi bo̱x ro hjua 'na, bido'u̱ ro ts'ii 'na, xi bo̱xro ts'äre 'na. ge'bu̱ go min pu̱n doja 'na.	bi boxro xi 'be̱ts'ina, bido'u̱ ro 'yu̱ni 'na, xi bi bo̱x ro hjua 'na, bido'u̱ ro ts'ii 'na, xi bo̱xro ts'äre 'na. ge'bu̱ go min pu̱n doja 'na.	bi bošro ši ʔbɛcʔina, bidoʔɨ ro ʔyɨni ʔna, ši bi bɔš ro hkhua ʔna, bidoʔɨ ro cʔii ʔna, ši bɔšro cʔᶏre ʔna. geʔbɨ go min pɨn dokha ʔna.	bi boʃɾo ʃi ʔbɛt͡sʔina, bidoʔɨ ro ʔjɨni ʔna, ʃi bi bɔʃ ro hkhua ʔna, bidoʔɨ ro t͡sʔii ʔna, ʃi bɔʃɾo t͡sʔãɾe ʔna. geʔbɨ go min pɨn dokha ʔna.																		
64	nso̱ho̱jä'i	gatho nuna hai ha nuna R'ayo Ximhai njabu̱ bi thutuabi nuya nso̱ho̱jä'i inbi tsa bi thutuabi man'a ra thuhu.	gatjo nuna jai ja nuna r'ayo ximjai nkjabu̱ bi tjutuabi nuya nso̱jo̱jä'i inbi tsa bi tjutuabi man'a ra tjuju.	gatho nuna hai ha nuna r'ayo ximhai njabu̱ bi thutuabi nuya nso̱ho̱jä'i inbi tsa bi thutuabi man'a ra thuhu.	gatho nuna hai ha nuna r'ayo ximhai njabu̱ bi thutuabi nuya nso̱ho̱jä'i inbi tsa bi thutuabi man'a ra thuhu.	gatho nuna hai ha nuna rʔayo šimhai nkhabɨ bi thutuabi nuya nsɔhɔkhᶏʔi inbi ca bi thutuabi manʔa ra thuhu.	gatho nuna hai ha nuna rʔajo ʃimhai nkhabɨ bi thutuabi nuja nsɔhɔkhãʔi inbi t͡sa bi thutuabi manʔa ra thuhu.																		
66	juän'ahmä	Ham'u̱ gatho ya juän'ahmä ge nuua xa ze̱ti ri ñ'ehe dige'a ya noya ya mu̱dimehai ha ra hñä ya ndeznä, nuna thuhu ri uni inga se̱he̱ ra n'atsanoya pa da fädi ra hñämfo̱, ingi ri me̱udi dige'a ra hmä fu̱oti dige'a nuna ra hñäki ra Netzahualcoyotl. Ne ra Cuauhtémoc.	jam'u̱ gatjo ya kjuän'ajmä ge nuua xa ze̱ti ri ñ'eje dige'a ya noya ya mu̱dimejai ja ra jñä ya ndeznä, nuna tjuju ri uni inga se̱je̱ ra n'atsanoya pa da fädi ra jñämfo̱, ingi ri me̱udi dige'a ra jmä fu̱oti dige'a nuna ra jñäki ra netzajualtsoyotl. ne ra cuauhtémoc.	ham'u̱ gatho ya juän'ahmä ge nuua xa ze̱ti ri ñ'ehe dige'a ya noya ya mu̱dimehai ha ra hñä ya ndeznä, nuna thuhu ri uni inga se̱he̱ ra n'atsanoya pa da fädi ra hñämfo̱, ingi ri me̱udi dige'a ra hmä fu̱oti dige'a nuna ra hñäki ra netzahualcoyotl. ne ra cuauhtémoc.	ham'u̱ gatho ya juän'ahmä ge nuua xa ze̱ti ri ñ'ehe dige'a ya noya ya mu̱dimehai ha ra hñä ya ndeznä, nuna thuhu ri uni inga se̱he̱ ra n'atsanoya pa da fädi ra hñämfo̱, ingi ri me̱udi dige'a ra hmä fu̱oti dige'a nuna ra hñäki ra netzahualcoyotl. ne ra cuauhtémoc.	hamʔɨ gatho ya khuᶏnʔahmᶏ ge nuua ša zɛti ri ñʔehe digeʔa ya noya ya mɨdimehai ha ra hñᶏ ya ndeznᶏ, nuna thuhu ri uni inga sɛhɛ ra nʔacanoya pa da phᶏdi ra hñᶏmphɔ, ingi ri mɛudi digeʔa ra hmᶏ phɨoti digeʔa nuna ra hñᶏki ra netzahualcoyotl. ne ra cuauhtémoc.	hamʔɨ gatho ja khuãnʔahmã ge nuua ʃa zɛti ri ɲʔehe digeʔa ja noja ja mɨdimehai ha ra hɲã ja ndeznã, nuna thuhu ri uni inga sɛhɛ ra nʔat͡sanoja pa da ɸãdi ra hɲãmɸɔ, ingi ri mɛudi digeʔa ra hmã ɸɨoti digeʔa nuna ra hɲãki ra netzahualkojotl. ne ra kuauhtémok.																		
68	jä'ihu̱	Ha bi häni ra ñ'udi, ma jä'ihu̱ bi ent'i gatho mahye̱gi nuya nzu̱te	ja bi jäni ra ñ'udi, ma kjä'iju̱ bi ent'i gatjo majye̱gi nuya nzu̱te	ha bi häni ra ñ'udi, ma jä'ihu̱ bi ent'i gatho mahye̱gi nuya nzu̱te	ha bi häni ra ñ'udi, ma jä'ihu̱ bi ent'i gatho mahye̱gi nuya nzu̱te	ha bi hᶏni ra ñʔudi, ma khᶏʔihɨ bi entʔi gatho mahyɛgi nuya nzɨte	ha bi hãni ra ɲʔudi, ma khãʔihɨ bi entʔi gatho mahjɛgi nuja nzɨte																		
70	jä'ihu̱	Mi hneki ngu ma jä'ihu̱ ngabu̱ mri hneki.	mi jneki ngu ma kjä'iju̱ ngabu̱ mri jneki.	mi hneki ngu ma jä'ihu̱ ngabu̱ mri hneki.	mi hneki ngu ma jä'ihu̱ ngabu̱ mri hneki.	mi hneki ngu ma khᶏʔihɨ ngabɨ mri hneki.	mi hneki ngu ma khãʔihɨ ngabɨ mɾi hneki.																		
71	jä'ihu̱	¿Te da o̱t'e ma jä'ihu̱ sta b'e̱dihu̱?	¿te da o̱t'e ma kjä'iju̱ sta b'e̱diju̱?	¿te da o̱t'e ma jä'ihu̱ sta b'e̱dihu̱?	¿te da o̱t'e ma jä'ihu̱ sta b'e̱dihu̱?	¿te da ɔtʔe ma khᶏʔihɨ sta bʔɛdihɨ?	¿te da ɔtʔe ma khãʔihɨ sta bʔɛdihɨ?																		
75	manjuäntho	R'a ya jä'i mi b'u̱i ha ra ngumi ja nunu ha ra hnini ri manjuäntho pa da tsoni nubu̱ ra Amáxac,	r'a ya kjä'i mi b'u̱i ja ra ngumi kja nunu ja ra jnini ri mankjuäntjo pa da tsoni nubu̱ ra amáxac,	r'a ya jä'i mi b'u̱i ha ra ngumi ja nunu ha ra hnini ri manjuäntho pa da tsoni nubu̱ ra amáxac,	r'a ya jä'i mi b'u̱i ha ra ngumi ja nunu ha ra hnini ri manjuäntho pa da tsoni nubu̱ ra amáxac,	rʔa ya khᶏʔi mi bʔɨi ha ra ngumi kha nunu ha ra hnini ri mankhuᶏntho pa da coni nubɨ ra amášac,	rʔa ja khãʔi mi bʔɨi ha ra ngumi kha nunu ha ra hnini ri mankhuãntho pa da t͡soni nubɨ ra amáʃat͡s,																		
78	manjuäntho	Into y'o manjuäntho, into pa ri nektho.	into y'o mankjuäntjo, into pa ri nektjo.	into y'o manjuäntho, into pa ri nektho.	into y'o manjuäntho, into pa ri nektho.	into yʔo mankhuᶏntho, into pa ri nektho.	into jʔo mankhuãntho, into pa ri nektho.																		
79	manjuäntho	bi ma manjuäntho habu̱ mi b'u̱i ra Ts'e̱y'e̱hmu bi xipabi;	bi ma mankjuäntjo jabu̱ mi b'u̱i ra ts'e̱y'e̱jmu bi xipabi;	bi ma manjuäntho habu̱ mi b'u̱i ra ts'e̱y'e̱hmu bi xipabi;	bi ma manjuäntho habu̱ mi b'u̱i ra ts'e̱y'e̱hmu bi xipabi;	bi ma mankhuᶏntho habɨ mi bʔɨi ra cʔɛyʔɛhmu bi šipabi;	bi ma mankhuãntho habɨ mi bʔɨi ra t͡sʔɛjʔɛhmu bi ʃipabi;																		
89	jakagihe	T'ena ge inbi unga mfädi pa gatho ya jä'i mi ñ'oui, ge nuna ndada ra Marqués da ñ'ehe dra hmu ha ma haihe, da ja me̱ti nu'a di pe̱tsihe nehe dra jakagihe ga mpe̱fihe ra hai ge bi umbabi o bi hänbabi ya hoga hai ya n'añ'o hnini.	t'ena ge inbi unga mfädi pa gatjo ya kjä'i mi ñ'oui, ge nuna ndada ra marqués da ñ'eje dra jmu ja ma jaije, da ja me̱ti nu'a di pe̱tsije neje dra kjakagije ga mpe̱fije ra jai ge bi umbabi o bi jänbabi ya joga jai ya n'añ'o jnini.	t'ena ge inbi unga mfädi pa gatho ya jä'i mi ñ'oui, ge nuna ndada ra marqués da ñ'ehe dra hmu ha ma haihe, da ja me̱ti nu'a di pe̱tsihe nehe dra jakagihe ga mpe̱fihe ra hai ge bi umbabi o bi hänbabi ya hoga hai ya n'añ'o hnini.	t'ena ge inbi unga mfädi pa gatho ya jä'i mi ñ'oui, ge nuna ndada ra marqués da ñ'ehe dra hmu ha ma haihe, da ja me̱ti nu'a di pe̱tsihe nehe dra jakagihe ga mpe̱fihe ra hai ge bi umbabi o bi hänbabi ya hoga hai ya n'añ'o hnini.	tʔena ge inbi unga mphᶏdi pa gatho ya khᶏʔi mi ñʔoui, ge nuna ndada ra marqués da ñʔehe dra hmu ha ma haihe, da kha mɛti nuʔa di pɛcihe nehe dra khakagihe ga mpɛphihe ra hai ge bi umbabi o bi hᶏnbabi ya hoga hai ya nʔañʔo hnini.	tʔena ge inbi unga mɸãdi pa gatho ja khãʔi mi ɲʔoui, ge nuna ndada ra maɾkés da ɲʔehe dɾa hmu ha ma haihe, da kha mɛti nuʔa di pɛt͡sihe nehe dɾa khakagihe ga mpɛɸihe ra hai ge bi umbabi o bi hãnbabi ja hoga hai ja nʔaɲʔo hnini.	T'ena ge inbi unga mfädi pa gatho ya jä'i mi ñ'oui, ge nuna ndada ra Marqués da ñ'ehe dra hmu ha ma haihe, da ja me̱ti nu'a di pe̱tsihe nehe dra jakagihe ga mpe̱fihe ra hai ge bi umbabi o bi hänbabi ya hoga hai ya n'añ'o hnini.	t'ena ge inbi unga mfädi pa gatjo ya jä'i mi ñ'oui, ge nuna ndada ra marqués da ñ'eje dra jmu ja ma jaije, da ja me̱ti nu'a di pe̱tsije neje dra jakagije ga mpe̱fije ra jai ge bi umbabi o bi jänbabi ya joga jai ya n'añ'o jnini.	t'ena ge inbi unga mfädi pa gatho ya jä'i mi ñ'oui, ge nuna ndada ra marqués da ñ'ehe dra hmu ha ma haihe, da ja me̱ti nu'a di pe̱tsihe nehe dra jakagihe ga mpe̱fihe ra hai ge bi umbabi o bi hänbabi ya hoga hai ya n'añ'o hnini.	t'ena ge inbi unga mfädi pa gatho ya jä'i mi ñ'oui, ge nuna ndada ra marqués da ñ'ehe dra hmu ha ma haihe, da ja me̱ti nu'a di pe̱tsihe nehe dra jakagihe ga mpe̱fihe ra hai ge bi umbabi o bi hänbabi ya hoga hai ya n'añ'o hnini.	tʔena ge inbi unga mphᶏdi pa gatho ya khᶏʔi mi ñʔoui, ge nuna ndada ra marqués da ñʔehe dra hmu ha ma haihe, da kha mɛti nuʔa di pɛcihe nehe dra khakagihe ga mpɛphihe ra hai ge bi umbabi o bi hᶏnbabi ya hoga hai ya nʔañʔo hnini.	tʔena ge inbi unga mɸãdi pa gatho ja khãʔi mi ɲʔoui, ge nuna ndada ra maɾqués da ɲʔehe dɾa hmu ha ma haihe, da kha mɛti nuʔa di pɛt͡sihe nehe dɾa khakagihe ga mpɛɸihe ra hai ge bi umbabi o bi hãnbabi ja hoga hai ja nʔaɲʔo hnini.	T'ena ge inbi unga mfädi pa gatho ya jä'i mi ñ'oui, ge nuna ndada ra Marqués da ñ'ehe dra hmu ha ma haihe, da ja me̱ti nu'a di pe̱tsihe nehe dra jakagihe ga mpe̱fihe ra hai ge bi umbabi o bi hänbabi ya hoga hai ya n'añ'o hnini.	t'ena ge inbi unga mfädi pa gatjo ya jä'i mi ñ'oui, ge nuna ndada ra marqués da ñ'eje dra jmu ja ma jaije, da ja me̱ti nu'a di pe̱tsije neje dra jakagije ga mpe̱fije ra jai ge bi umbabi o bi jänbabi ya joga jai ya n'añ'o jnini.	t'ena ge inbi unga mfädi pa gatho ya jä'i mi ñ'oui, ge nuna ndada ra marqués da ñ'ehe dra hmu ha ma haihe, da ja me̱ti nu'a di pe̱tsihe nehe dra jakagihe ga mpe̱fihe ra hai ge bi umbabi o bi hänbabi ya hoga hai ya n'añ'o hnini.	t'ena ge inbi unga mfädi pa gatho ya jä'i mi ñ'oui, ge nuna ndada ra marqués da ñ'ehe dra hmu ha ma haihe, da ja me̱ti nu'a di pe̱tsihe nehe dra jakagihe ga mpe̱fihe ra hai ge bi umbabi o bi hänbabi ya hoga hai ya n'añ'o hnini.	tʔena ge inbi unga mphᶏdi pa gatho ya khᶏʔi mi ñʔoui, ge nuna ndada ra marqués da ñʔehe dra hmu ha ma haihe, da kha mɛti nuʔa di pɛcihe nehe dra khakagihe ga mpɛphihe ra hai ge bi umbabi o bi hᶏnbabi ya hoga hai ya nʔañʔo hnini.	tʔena ge inbi unga mɸãdi pa gatho ja khãʔi mi ɲʔoui, ge nuna ndada ra maɾqués da ɲʔehe dɾa hmu ha ma haihe, da kha mɛti nuʔa di pɛt͡sihe nehe dɾa khakagihe ga mpɛɸihe ra hai ge bi umbabi o bi hãnbabi ja hoga hai ja nʔaɲʔo hnini.	T'ena ge inbi unga mfädi pa gatho ya jä'i mi ñ'oui, ge nuna ndada ra Marqués da ñ'ehe dra hmu ha ma haihe, da ja me̱ti nu'a di pe̱tsihe nehe dra jakagihe ga mpe̱fihe ra hai ge bi umbabi o bi hänbabi ya hoga hai ya n'añ'o hnini.	t'ena ge inbi unga mfädi pa gatjo ya jä'i mi ñ'oui, ge nuna ndada ra marqués da ñ'eje dra jmu ja ma jaije, da ja me̱ti nu'a di pe̱tsije neje dra jakagije ga mpe̱fije ra jai ge bi umbabi o bi jänbabi ya joga jai ya n'añ'o jnini.	t'ena ge inbi unga mfädi pa gatho ya jä'i mi ñ'oui, ge nuna ndada ra marqués da ñ'ehe dra hmu ha ma haihe, da ja me̱ti nu'a di pe̱tsihe nehe dra jakagihe ga mpe̱fihe ra hai ge bi umbabi o bi hänbabi ya hoga hai ya n'añ'o hnini.	t'ena ge inbi unga mfädi pa gatho ya jä'i mi ñ'oui, ge nuna ndada ra marqués da ñ'ehe dra hmu ha ma haihe, da ja me̱ti nu'a di pe̱tsihe nehe dra jakagihe ga mpe̱fihe ra hai ge bi umbabi o bi hänbabi ya hoga hai ya n'añ'o hnini.	tʔena ge inbi unga mphᶏdi pa gatho ya khᶏʔi mi ñʔoui, ge nuna ndada ra marqués da ñʔehe dra hmu ha ma haihe, da kha mɛti nuʔa di pɛcihe nehe dra khakagihe ga mpɛphihe ra hai ge bi umbabi o bi hᶏnbabi ya hoga hai ya nʔañʔo hnini.	tʔena ge inbi unga mɸãdi pa gatho ja khãʔi mi ɲʔoui, ge nuna ndada ra maɾqués da ɲʔehe dɾa hmu ha ma haihe, da kha mɛti nuʔa di pɛt͡sihe nehe dɾa khakagihe ga mpɛɸihe ra hai ge bi umbabi o bi hãnbabi ja hoga hai ja nʔaɲʔo hnini.
92	ajuähu̱,	y'o, ri ma ne gi xipabihu̱ ya metlaxcala ge ma r'a ya me̱ti jä'i ne ri ajuähu̱, ge nu'a ga mä ge xa ehe nuua ma haihu̱, ge di umbabihe ma nthädihe.	y'o, ri ma ne gi xipabiju̱ ya metlaxcala ge ma r'a ya me̱ti kjä'i ne ri ajuäju̱, ge nu'a ga mä ge xa eje nuua ma jaiju̱, ge di umbabije ma ntjädije.	y'o, ri ma ne gi xipabihu̱ ya metlaxcala ge ma r'a ya me̱ti jä'i ne ri ajuähu̱, ge nu'a ga mä ge xa ehe nuua ma haihu̱, ge di umbabihe ma nthädihe.	y'o, ri ma ne gi xipabihu̱ ya metlaxcala ge ma r'a ya me̱ti jä'i ne ri ajuähu̱, ge nu'a ga mä ge xa ehe nuua ma haihu̱, ge di umbabihe ma nthädihe.	yʔo, ri ma ne gi šipabihɨ ya metlašcala ge ma rʔa ya mɛti khᶏʔi ne ri akhuᶏhɨ, ge nuʔa ga mᶏ ge ša ehe nuua ma haihɨ, ge di umbabihe ma nthᶏdihe.	jʔo, ri ma ne gi ʃipabihɨ ja metlaʃkala ge ma rʔa ja mɛti khãʔi ne ri akhuãhɨ, ge nuʔa ga mã ge ʃa ehe nuua ma haihɨ, ge di umbabihe ma nthãdihe.																		
93	nso̱ho̱jä'i,	Ra nthädi ra Cuitlahuacatzin bi ena ge ina da o̱t'e nuya bi b'e̱pabi ya nso̱ho̱jä'i,	ra ntjädi ra cuitlahuacatzin bi ena ge ina da o̱t'e nuya bi b'e̱pabi ya nso̱jo̱jä'i,	ra nthädi ra cuitlahuacatzin bi ena ge ina da o̱t'e nuya bi b'e̱pabi ya nso̱ho̱jä'i,	ra nthädi ra cuitlahuacatzin bi ena ge ina da o̱t'e nuya bi b'e̱pabi ya nso̱ho̱jä'i,	ra nthᶏdi ra cuitlahuacatzin bi ena ge ina da ɔtʔe nuya bi bʔɛpabi ya nsɔhɔkhᶏʔi,	ra nthãdi ra kuitlahuakatzin bi ena ge ina da ɔtʔe nuja bi bʔɛpabi ja nsɔhɔkhãʔi,																		
94	jä'ihe	Dra jä'ihe ha nu'a ra hnini.	dra kjä'ihe ja nu'a ra jnini.	dra jä'ihe ha nu'a ra hnini.	dra jä'ihe ha nu'a ra hnini.	dra khᶏʔihe ha nuʔa ra hnini.	dɾa khãʔihe ha nuʔa ra hnini.																		
97	juatihe	ma bo̱nahmu'ihe: nuna b'e̱fi ga tsokagihe sta juatihe gatho: gi nuti nuua, xa hño bo̱nahmu.	ma bo̱najmu'ije: nuna b'e̱fi ga tsokagije sta kjuatihe gatjo: gi nuti nuua, xa jño bo̱najmu.	ma bo̱nahmu'ihe: nuna b'e̱fi ga tsokagihe sta juatihe gatho: gi nuti nuua, xa hño bo̱nahmu.	ma bo̱nahmu'ihe: nuna b'e̱fi ga tsokagihe sta juatihe gatho: gi nuti nuua, xa hño bo̱nahmu.	ma bɔnahmuʔihe: nuna bʔɛphi ga cokagihe sta khuatihe gatho: gi nuti nuua, ša hño bɔnahmu.	ma bɔnahmuʔihe: nuna bʔɛɸi ga t͡sokagihe sta khuatihe gatho: gi nuti nuua, ʃa hɲo bɔnahmu.																		
99	ju̱he	Habu̱ ga ju̱he nuyu̱ (ya tenochcas) te gi honihu̱?	jabu̱ ga kju̱he nuyu̱ (ya tenochcas) te gi joniju̱?	habu̱ ga ju̱he nuyu̱ (ya tenochcas) te gi honihu̱?	habu̱ ga ju̱he nuyu̱ (ya tenochcas) te gi honihu̱?	habɨ ga khɨhe nuyɨ (ya tenočcas) te gi honihɨ?	habɨ ga khɨhe nujɨ (ja tenot͡ʃkas) te gi honihɨ?																		
100	ju̱kagihe	di to̱m'ihe ra ñ'ethi pa nugagihe, n'a ra pa ngu ma n'a ra pa thogi nekagihe di huadihe ra nge'a indi tse̱tihe nuna b'u̱i t'o̱t'e ko ngekagihe man'año ya ntho, t'e̱nts'igihe thi ma haihe ma me̱tihe, ju̱kagihe ga mpe̱fihe ndunthi, b'e̱kagihe ga jut'ihe xdunthi ya boja, n'a ngu n'a ra pa nuna njut'i di o̱t'ehe man'a te ma thaihe di tuhe.	di to̱m'ihe ra ñ'etji pa nugagije, n'a ra pa ngu ma n'a ra pa tjogi nekagije di juadije ra nge'a indi tse̱tije nuna b'u̱i t'o̱t'e ko ngekagije man'año ya ntjo, t'e̱nts'igije tji ma jaije ma me̱tije, ju̱kagije ga mpe̱fije nduntji, b'e̱kagije ga jut'ije xduntji ya boja, n'a ngu n'a ra pa nuna njut'i di o̱t'eje man'a te ma tjaije di tuje.	di to̱m'ihe ra ñ'ethi pa nugagihe, n'a ra pa ngu ma n'a ra pa thogi nekagihe di huadihe ra nge'a indi tse̱tihe nuna b'u̱i t'o̱t'e ko ngekagihe man'año ya ntho, t'e̱nts'igihe thi ma haihe ma me̱tihe, ju̱kagihe ga mpe̱fihe ndunthi, b'e̱kagihe ga jut'ihe xdunthi ya boja, n'a ngu n'a ra pa nuna njut'i di o̱t'ehe man'a te ma thaihe di tuhe.	di to̱m'ihe ra ñ'ethi pa nugagihe, n'a ra pa ngu ma n'a ra pa thogi nekagihe di huadihe ra nge'a indi tse̱tihe nuna b'u̱i t'o̱t'e ko ngekagihe man'año ya ntho, t'e̱nts'igihe thi ma haihe ma me̱tihe, ju̱kagihe ga mpe̱fihe ndunthi, b'e̱kagihe ga jut'ihe xdunthi ya boja, n'a ngu n'a ra pa nuna njut'i di o̱t'ehe man'a te ma thaihe di tuhe.	di tɔmʔihe ra ñʔethi pa nugagihe, nʔa ra pa ngu ma nʔa ra pa thogi nekagihe di huadihe ra ngeʔa indi cɛtihe nuna bʔɨi tʔɔtʔe ko ngekagihe manʔaño ya ntho, tʔɛncʔigihe thi ma haihe ma mɛtihe, khɨkagihe ga mpɛphihe ndunthi, bʔɛkagihe ga khutʔihe šdunthi ya bokha, nʔa ngu nʔa ra pa nuna nkhutʔi di ɔtʔehe manʔa te ma thaihe di tuhe.	di tɔmʔihe ra ɲʔethi pa nugagihe, nʔa ra pa ngu ma nʔa ra pa thogi nekagihe di huadihe ra ngeʔa indi t͡sɛtihe nuna bʔɨi tʔɔtʔe ko ngekagihe manʔaɲo ja ntho, tʔɛnt͡sʔigihe thi ma haihe ma mɛtihe, khɨkagihe ga mpɛɸihe ndunthi, bʔɛkagihe ga khutʔihe ʃdunthi ja bokha, nʔa ngu nʔa ra pa nuna nkhutʔi di ɔtʔehe manʔa te ma thaihe di tuhe.																		
103	jut'ihe	Nub'u̱ ndi umbabihe ma njut'ihe xki nzäi ndi da'ihe, mi adi n'a tu̱ki nehe nub'u̱ ndi unihe ya k'astaboja mi häni made n'a tu̱ki [...]	nub'u̱ ndi umbabije ma nkjut'ije xki nzäi ndi da'ije, mi adi n'a tu̱ki neje nub'u̱ ndi unije ya k'astaboja mi jäni made n'a tu̱ki [...]	nub'u̱ ndi umbabihe ma njut'ihe xki nzäi ndi da'ihe, mi adi n'a tu̱ki nehe nub'u̱ ndi unihe ya k'astaboja mi häni made n'a tu̱ki [...]	nub'u̱ ndi umbabihe ma njut'ihe xki nzäi ndi da'ihe, mi adi n'a tu̱ki nehe nub'u̱ ndi unihe ya k'astaboja mi häni made n'a tu̱ki [...]	nubʔɨ ndi umbabihe ma nkhutʔihe ški nzᶏi ndi daʔihe, mi adi nʔa tɨki nehe nubʔɨ ndi unihe ya kʔastabokha mi hᶏni made nʔa tɨki [...]	nubʔɨ ndi umbabihe ma nkhutʔihe ʃki nzãi ndi daʔihe, mi adi nʔa tɨki nehe nubʔɨ ndi unihe ja kʔastabokha mi hãni made nʔa tɨki [...]																		
105	johya,	Ndunthi bri johya, bri thuxpabi gatho nu'a mi o̱t'abi ra b'edi, ko nge'u̱ bi m'u̱i ne mi t'umbabi ya t'ixu:	nduntji bri kjojya, bri tjuxpabi gatjo nu'a mi o̱t'abi ra b'edi, ko nge'u̱ bi m'u̱i ne mi t'umbabi ya t'ixu:	ndunthi bri johya, bri thuxpabi gatho nu'a mi o̱t'abi ra b'edi, ko nge'u̱ bi m'u̱i ne mi t'umbabi ya t'ixu:	ndunthi bri johya, bri thuxpabi gatho nu'a mi o̱t'abi ra b'edi, ko nge'u̱ bi m'u̱i ne mi t'umbabi ya t'ixu:	ndunthi bri khohya, bri thušpabi gatho nuʔa mi ɔtʔabi ra bʔedi, ko ngeʔɨ bi mʔɨi ne mi tʔumbabi ya tʔišu:	ndunthi bɾi khohja, bɾi thuʃpabi gatho nuʔa mi ɔtʔabi ra bʔedi, ko ngeʔɨ bi mʔɨi ne mi tʔumbabi ja tʔiʃu:																		
106	johya,	Ya miñ'o ko ngehna hmä ri johya,	ya miñ'o ko ngejna jmä ri kjojya,	ya miñ'o ko ngehna hmä ri johya,	ya miñ'o ko ngehna hmä ri johya,	ya miñʔo ko ngehna hmᶏ ri khohya,	ja miɲʔo ko ngehna hmã ri khohja,																		
110	johi	Ra Alvarado bi johi bi ntsabi. Bi ma nuni Tlacopan da ntsaya.	ra alvarado bi kjoji bi ntsabi. bi ma nuni tlacopan da ntsaya.	ra alvarado bi johi bi ntsabi. bi ma nuni tlacopan da ntsaya.	ra alvarado bi johi bi ntsabi. bi ma nuni tlacopan da ntsaya.	ra alvarado bi khohi bi ncabi. bi ma nuni tlacopan da ncaya.	ra alvaɾado bi khohi bi nt͡sabi. bi ma nuni tlakopan da nt͡saja.																		
112	hanja...	Nuga̱ xi di ne'i, hindi pädi hanja...	nuga̱ xi di ne'i, jindi pädi jankja...	nuga̱ xi di ne'i, hindi pädi hanja...	nuga̱ xi di ne'i, hindi pädi hanja...	nugʌ ši di neʔi, hindi pᶏdi hankha...	nugə ʃi di neʔi, hindi pãdi hankha...																		
